business_id,business_name,business_type,location,main_products,target_customer_types,target_partner_types,pain_keywords,intent_keywords,exclusion_keywords,competitor_keywords,allowed_channels,priority,status,owner_approval_required,memo,ext_json,updated_at,version
ai_net_business,AIネットビジネス,digital_product,沖縄・全国,AI店舗集客7日間立て直しキット|業種別AI投稿テンプレ完全版|AI店舗集客導線30分診断|店舗向けAI集客OS導入サポート|月次AI集客改善サポート,小規模店舗オーナー|美容サロン|整体院|治療院|飲食店|カフェ|ネイルサロン|エステ|脱毛サロン|地域ビジネス,AI発信者|Brain販売者|集客系インフルエンサー,投稿ネタがない|SNSが続かない|Instagram更新できない|Google投稿を忘れる|口コミ返信が大変|キャンペーン告知が作れない|投稿する時間がない|AIの使い方が分からない,AI集客|自動投稿|ChatGPT活用|MEO改善|Threads活用|Google投稿,MEO業者|SNS運用代行|AIコンサル|ChatGPT講師|Brain販売者|副業で稼ぐ|情報商材|実店舗なし,MEOツール|AI集客ツール|競合教材,google_serp|instagram_serp|threads_serp,2,active,false,,{},2026-07-06,1
trees_catering,Trees Catering,catering,沖縄県,法人懇親会ケータリング|イベント・パーティー料理|BAR・クラブ・ホテルスイート向け出張料理|法人弁当・団体食事提供|同窓会・結婚式二次会・打ち上げ,企業|イベント会社|ホテル|会議室・レンタルスペース|BAR・クラブ|結婚式二次会|同窓会幹事|学校・団体|セミナー主催者|展示会・催事運営,イベント会社|ケータリング紹介者|ホテル宴会担当,ケータリング探している|イベント食事|法人弁当|懇親会料理|仕出し弁当|出張ケータリング|会社イベント,ケータリング依頼|法人イベント食事|弁当注文|懇親会手配|オードブル,競合ケータリング|個人単発予算過小|問い合わせ手段なし,競合ケータリング業者,google_serp|instagram_serp,1,active,false,,{},2026-07-06,1
tachinomiya,TACHINOMIYA,restaurant_bar,沖縄県那覇市国際通り,国際通り立ち飲みBAR|沖縄料理|サーターアンダギー|観光客向け軽飲食|2軒目需要,沖縄旅行者|観光客|2軒目需要層|一人旅|女子旅|カップル|家族旅行,沖縄旅行系メディア|ホテルコンシェルジュ|ツアー会社|沖縄グルメ紹介アカウント,2軒目どこ行く|国際通り飲み|沖縄一人旅グルメ|沖縄立ち飲み,国際通り|沖縄グルメ|食べ歩き|サーターアンダギー|立ち飲みBAR,競合立ち飲み|無断転載グルメ|安売り目当て,競合立ち飲みBAR,google_serp|instagram_serp|threads_serp,2,active,false,,{},2026-07-06,1
tree_beauty,Tree Beauty,beauty_salon,沖縄県西原・浦添・那覇周辺,脱毛|セルフホワイトニング|よもぎ蒸し|美容・温活・リラクゼーション,沖縄・西原・浦添・那覇周辺の美容関心層|ママ向け地域層|健康・温活・リラク系,美容室|ネイルサロン|まつ毛サロン|地域マルシェ主催|健康系発信者,脱毛したい|ホワイトニング気になる|よもぎ蒸し体験|脱毛サロン探し|温活したい,脱毛|ホワイトニング|よもぎ蒸し|美容サロン|温活,カッピング|医療効果断定|過激Before/After|競合サロン,競合美容サロン,google_serp|instagram_serp,3,inactive,false,,{},2026-07-06,1
ryukyu_hotpot,琉球火鍋,restaurant_premium,沖縄県,高単価火鍋|黒毛和牛・アグー豚・沖縄体験|インバウンド向け沖縄ディナー|誕生日・記念日・お祝い|接待・会食・観光・団体予約,インバウンド観光客|誕生日記念日お祝い需要層|接待・会食需要企業|団体予約・宴会需要|沖縄旅行者,ホテル|旅行会社・ツアー会社|訪日・沖縄旅行メディア|インバウンドメディア,沖縄で誕生日ディナー|記念日ディナー探し|沖縄グルメ高級|インバウンド沖縄ディナー|接待ディナー,Okinawa birthday dinner|Okinawa anniversary restaurant|Naha premium dinner|Okinawa wagyu hotpot|Okinawa celebration restaurant|Okinawa group dinner|Naha dinner reservation|誕生日ディナー|記念日ディナー|お祝いごはん|高単価予約,競合火鍋店|安さ訴求のみ|無断転載まとめ|低単価ランチ需要のみ|沖縄外,競合火鍋・高級鍋店,google_serp|instagram_serp,1,active,false,,{},2026-07-06,1
consulting,コンサル事業,consulting,沖縄・全国,飲食店・美容サロン向け集客改善コンサル|GBP改善|SNS投稿導線改善|AI投稿運用導入|月次改善サポート|成果報酬型コンサル|店舗向けAI集客導線設計|自動化導入支援,飲食店オーナー|美容サロンオーナー|地域ビジネス経営者|GBP・IG・Threads・口コミ投稿運用に課題がある実店舗,集客系インフルエンサー|経営改善支援機関|地域商工会,集客できない|予約が入らない|投稿が続かない|口コミが増えない|Google投稿停止|SNSから予約につながらない|AI導入できない|スタッフに任せられない|売上改善の打ち手不明,集客改善|AI導入|GBP改善|SNS運用改善|予約導線改善,同業コンサル|MEO業者|SNS運用代行|AIコンサル|情報商材|副業系|実店舗なし,競合コンサル,google_serp|instagram_serp,3,inactive,false,,{},2026-07-06,1
